title,price,area,volume,type,year,no_rooms,no_bed,no_bath,no_floor,balcony,garden,interior
For rent: Apartment Kleine Bleekstraat in Eindhoven,"€1,250 per month",75 m²,200 m³,Apartment,1956,3,2,nan,1,Not present,Not present,nan
For rent: Apartment Molenvlietbrink 1 in Woerden,€875 per month,58 m²,nan,Apartment,1989,3,2,1,nan,Present,Not present,Shell
For rent: Apartment Minervaplein in Amsterdam,"€2,850 per month",111 m²,320 m³,Apartment,1926,3,1,1,1,Present,Not present,Furnished
For rent: House Schoolpad 4 in Diemen,"€2,250 per month",104 m²,244 m³,House,1959,4,3,1,3,nan,Present,Furnished
For rent: Apartment Oudedijk in Rotterdam,"€1,150 per month",60 m²,nan,Apartment,nan,2,1,1,nan,Not present,Not present,Shell
For rent: House Ooievaarlaan 14 in Heemstede,"€3,885 per month",165 m²,785 m³,House,2009,7,5,2,nan,nan,Present (180 m²),Upholstered
For rent: Room Oostmaaslaan in Rotterdam,€900 per month,20 m²,nan,Room,nan,1,nan,nan,nan,nan,nan,Upholstered or furnished
For rent: Apartment Smalle Haven in Eindhoven,"€3,250 per month",136 m²,nan,Apartment,nan,3,2,1,1,Present,Not present,Furnished
For rent: Apartment Lage Hoek in Zwaag,"€1,150 per month",58 m²,nan,Apartment,nan,2,1,1,nan,Not present,Present,Upholstered
For rent: Apartment Singel in Delfzijl,€763 per month,66 m²,nan,Apartment,nan,2,1,1,nan,Not present,"Present (41 m², located on the south-east)",Upholstered
For rent: Apartment Jennerstraat in Amsterdam,"€2,300 per month",108 m²,250 m³,Apartment,1960-1970,6,4,nan,1,Not present,Present,nan
For rent: Apartment Wattbaan in Nieuwegein,"€1,620 per month",85 m²,200 m³,Apartment,2021,4,3,1,1,Not present,Present,Furnished
For rent: Studio Saftlevenstraat in Rotterdam,€743 per month,30 m²,nan,Studio,1895,1,1,1,1,nan,Not present,Upholstered
For rent: Apartment Pastoor Ossestraat in Hengelo,€725 per month,46 m²,nan,Apartment,1978,2,1,1,nan,nan,nan,Furnished
For rent: House Bargereed in Tzummarum,€900 per month,70 m²,nan,House,nan,4,3,1,1,nan,Present,Furnished
For rent: Apartment Berkenlaan in Hoogland,€995 per month,69 m²,nan,Apartment,nan,2,2,nan,nan,Present,Not present,Upholstered
For rent: Apartment Nieuweroord in Leiden,"€1,560 per month",59 m²,nan,Apartment,2020,2,1,1,nan,nan,nan,Upholstered
For rent: Studio Wierdensestraat in Almelo,€720 per month,30 m²,nan,Studio,nan,1,nan,nan,nan,nan,nan,Furnished
For rent: Apartment Coornhertstraat in Den Haag,"€1,700 per month",95 m²,290 m³,Apartment,1938,4,3,1,1,Present,Not present,Upholstered
For rent: Apartment Stroomzijde 78 in Blaricum,"€1,549 per month",126 m²,nan,Apartment,2011,3,2,1,nan,Present,Not present,Upholstered
For rent: House De Witte Raaflaan in Noordwijk,"€1,995 per month",110 m²,nan,House,2022,4,3,2,nan,nan,nan,Furnished
For rent: House Nieuwe Plantage in Delft,"€2,975 per month",235 m²,611 m³,House,1893,6,4,3,3,Present,Present (300 m²),Upholstered
For rent: Apartment Kraneweg in Groningen,"€1,595 per month",52 m²,nan,Apartment,nan,2,1,nan,nan,nan,Not present,Furnished
For rent: Apartment Koningin Julianalaan 48 in Katwijk,"€1,250 per month",85 m²,221 m³,Apartment,1958,2,2,1,1,Present,nan,Furnished
For rent: House Noorderbuurt in Huizen,"€3,450 per month",117 m²,nan,House,nan,5,2,2,nan,Not present,Present,Upholstered
For rent: Apartment Eikenlaan in Bussum,€995 per month,60 m²,nan,Apartment,nan,2,1,1,nan,Not present,Present,Furnished
For rent: Apartment Jonkerbos 218 in Zoetermeer,"€1,195 per month",78 m²,240 m³,Apartment,1972,3,2,nan,1,Not present,Not present,nan
For rent: Apartment Pallashof in Brunssum,"€1,200 per month",67 m²,240 m³,Apartment,1982,3,2,1,1,Present,Not present,Furnished
For rent: Apartment Jacob van Lennepkade in Amsterdam,"€2,075 per month",65 m²,162 m³,Apartment,1906,2,1,1,1,Not present,Not present,Furnished
For rent: House Vermeerstraat 5 in Krimpen aan den IJssel,€935 per month,78 m²,nan,House,1956,4,3,1,nan,Present,Present,Shell
For rent: Apartment Lauriergracht 142 A in Amsterdam,"€2,450 per month",53 m²,150 m³,Apartment,1929,2,1,1,1,Present,nan,Furnished
For rent: Apartment Van Boecopkade in Den Haag,€752 per month,40 m²,200 m³,Apartment,2017,1,nan,nan,1,nan,Not present,Furnished
For rent: Apartment Nieuwe Kruisstraat 24 A Rd in Haarlem,"€2,150 per month",84 m²,335 m³,Apartment,1885,3,2,1,2,Not present,nan,Upholstered or furnished
For rent: House Huis Millen in Sittard,"€1,975 per month",250 m²,nan,House,nan,6,3,nan,nan,nan,Present,Upholstered
For rent: House 1e Jerichostraat 57 A in Rotterdam,"€2,500 per month",110 m²,300 m³,House,nan,4,3,1,2,nan,Present,Furnished
For rent: Apartment Minervaplein in Amsterdam,"€2,850 per month",111 m²,320 m³,Apartment,1926,3,1,1,1,Present,Not present,Furnished
For rent: Apartment Reguliersdwarsstraat 100 C in Amsterdam,"€3,250 per month",104 m²,312 m³,Apartment,Before 1906,3,2,2,1,Present,Not present,Upholstered
For rent: Apartment Reguliersdwarsstraat 98 F in Amsterdam,"€2,750 per month",85 m²,255 m³,Apartment,2022,3,2,1,1,Not present,Not present,Upholstered
For rent: Apartment Reguliersdwarsstraat 98 D in Amsterdam,"€2,950 per month",91 m²,273 m³,Apartment,2022,3,2,2,1,Present,Not present,Upholstered
For rent: Apartment Reguliersdwarsstraat 100 E in Amsterdam,"€2,150 per month",65 m²,195 m³,Apartment,Before 1906,3,2,1,1,Not present,Not present,Upholstered
For rent: Apartment Reguliersdwarsstraat 100 D in Amsterdam,"€3,100 per month",97 m²,291 m³,Apartment,Before 1906,3,2,2,1,Present,Not present,Upholstered
For rent: Apartment Reguliersdwarsstraat 100 F in Amsterdam,"€2,150 per month",66 m²,198 m³,Apartment,Before 1906,3,2,1,1,Not present,Not present,nan
For rent: Apartment Reguliersdwarsstraat 98 E in Amsterdam,"€2,750 per month",85 m²,255 m³,Apartment,2022,3,2,1,1,Not present,Not present,Upholstered
For rent: Apartment Reguliersdwarsstraat 98 C in Amsterdam,"€2,950 per month",92 m²,276 m³,Apartment,2022,3,2,2,1,Present,Not present,Upholstered
For rent: Apartment Reguliersdwarsstraat 98 B in Amsterdam,"€2,950 per month",92 m²,276 m³,Apartment,2022,3,2,2,1,Present,Not present,Upholstered
For rent: Apartment Reguliersdwarsstraat 98 A in Amsterdam,"€2,950 per month",92 m²,276 m³,Apartment,2022,3,2,2,1,Present,Not present,Upholstered
For rent: Apartment Bergse Dorpsstraat 116 C in Rotterdam,"€1,395 per month",55 m²,149 m³,Apartment,Before 1906,2,1,nan,1,Not present,Present,nan
For rent: House De Witte Raaflaan in Noordwijk,"€1,855 per month",125 m²,nan,House,2000,4,3,1,nan,nan,Present (280 m²),nan
For rent: Room Tongerseweg in Maastricht,€525 per month,17 m²,nan,Room,nan,1,nan,nan,nan,nan,nan,Upholstered
For rent: House Zuylesteinstraat 21 in Almere,"€1,650 per month",93 m²,290 m³,House,1991,5,3,1,3,Present,Not present,Furnished
For rent: Apartment Hooikade 51 in Den Haag,"€2,450 per month",140 m²,420 m³,Apartment,1900,6,4,2,3,Present,nan,Furnished
For rent: House de Biestermannen in Heeze,"€1,500 per month",117 m²,nan,House,nan,5,4,nan,1,nan,Present,Upholstered
For rent: House Van Embdenruimte in Zoetermeer,"€1,545 per month",117 m²,292 m³,House,1988,5,4,nan,2,nan,Present,Furnished
For rent: House De Deel in Hoevelaken,"€2,150 per month",158 m²,nan,House,2000,6,4,1,nan,nan,"Present (102 m², located on the north-west)",Upholstered
For rent: House Wijde Doelen in Utrecht,"€1,495 per month",84 m²,210 m³,House,1900,3,2,1,2,nan,Not present,Upholstered
For rent: Apartment De Savornin Lohmanlaan 25 in Den Haag,"€1,995 per month",127 m²,381 m³,Apartment,1956,5,4,2,4,Not present,nan,Upholstered or furnished
For rent: House Orangerie in Almelo,"€1,350 per month",97 m²,nan,House,2004,4,3,1,nan,nan,Present (50 m²),Upholstered
For rent: Apartment Tuinen in Leeuwarden,€800 per month,60 m²,nan,Apartment,2021,2,1,1,1,nan,Not present,Upholstered
For rent: Apartment Hoog Maanen in Ede,"€1,325 per month",73 m²,200 m³,Apartment,2004,3,2,1,1,nan,Not present,nan
For rent: House Lohengrinstraat in Den Haag,"€2,500 per month",153 m²,573 m³,House,1936,7,5,2,4,Present,"Present (48 m², located on the north-west)",Upholstered
For rent: Apartment Willemstraat 89 in Den Haag,"€2,000 per month",80 m²,208 m³,Apartment,1930,3,2,2,2,Present,Present (10 m²),Furnished
For rent: Apartment Kapelstraat 109 in Uden,€900 per month,90 m²,nan,Apartment,1983,3,2,1,nan,Present,Not present,Shell
For rent: Apartment Essenburgsingel in Rotterdam,"€1,050 per month",32 m²,nan,Apartment,nan,2,1,1,nan,Not present,Not present,Furnished
For rent: Apartment Koningstraat 21 A2 in Arnhem,"€1,250 per month",82 m²,250 m³,Apartment,1954,4,3,1,1,Present,Not present,Upholstered
For rent: House Oosterlaan in Nunspeet,"€1,500 per month",120 m²,nan,House,nan,4,2,1,nan,nan,nan,Furnished
For rent: Apartment Graaf Hendrik III laan in Breda,"€1,200 per month",88 m²,230 m³,Apartment,1955,4,2,1,1,Present,Not present,Upholstered
For rent: House Winkeldijk 19 AR88 in Vinkeveen,"€1,300 per month",70 m²,nan,House,nan,3,2,1,nan,Not present,Present,Furnished
For rent: Apartment Albert Cuypstraat 31 1 in Amsterdam,"€1,950 per month",50 m²,153 m³,Apartment,1890,2,1,1,1,Present,Not present,Upholstered or furnished
For rent: Apartment Fagelstraat 94 3 in Amsterdam,"€2,500 per month",92 m²,276 m³,Apartment,1906,3,2,1,2,Not present,Present,Furnished
For rent: Apartment Nieuwe Plein in Arnhem,€675 per month,24 m²,nan,Apartment,nan,1,1,nan,nan,Not present,Not present,Upholstered
For rent: Apartment Vierambachtsstraat in Rotterdam,"€1,225 per month",57 m²,nan,Apartment,nan,2,1,1,nan,Present,Not present,Upholstered
For rent: House Falstaff in Eindhoven,"€1,900 per month",148 m²,nan,House,1998,6,5,2,nan,Not present,Not present,Upholstered
For rent: Apartment Anna van Buerenplein in Den Haag,"€3,495 per month",114 m²,360 m³,Apartment,2012,4,3,1,1,Not present,Present,Furnished
For rent: Apartment Leidsekruisstraat in Amsterdam,"€2,000 per month",57 m²,300 m³,Apartment,Before 1906,3,2,nan,1,Not present,Not present,nan
For rent: House Dortherweg 32 in Epse,"€1,395 per month",137 m²,nan,House,nan,4,3,1,nan,Not present,"Present (50 m², located on the north-west)",Upholstered
For rent: Apartment Nieuwstraat in Son en Breugel,€764 per month,29 m²,nan,Apartment,nan,2,1,1,nan,Not present,Present,Furnished
For rent: House Scheibaan 11 B in Oisterwijk,"€2,300 per month",200 m²,550 m³,House,1980,7,5,1,1,nan,Present,Shell
For rent: House Lieshoutseweg 8 B in Nuenen,"€1,750 per month",37 m²,120 m³,House,2009,1,1,1,1,nan,Present,Furnished
For rent: Apartment De Ruijterstraat in Den Haag,"€3,500 per month",159 m²,460 m³,Apartment,1900,5,3,2,2,nan,Not present,Upholstered
For rent: Apartment Zaagmolenstraat in Rotterdam,€895 per month,54 m²,nan,Apartment,1899,2,1,nan,nan,Present,Not present,Upholstered
For rent: Apartment Dr. Benthemstraat in Enschede,"€1,295 per month",110 m²,nan,Apartment,nan,4,2,1,1,nan,Not present,Upholstered
For rent: House Koningstraat in Heerlen,€760 per month,76 m²,240 m³,House,1906-1930,7,3,nan,1,Not present,Present,nan
For rent: Apartment Daal en Bergselaan 56 B in Den Haag,"€1,775 per month",88 m²,270 m³,Apartment,2002,4,2,1,1,Present,Present (15 m²),Upholstered
For rent: Apartment Hildebrandhove in Zoetermeer,"€1,095 per month",55 m²,137 m³,Apartment,nan,2,1,nan,1,Present,Not present,Upholstered
For rent: Apartment de Wetstraat in Breda,"€1,550 per month",79 m²,nan,Apartment,1956,3,2,1,nan,Present,nan,Furnished
For rent: Apartment Prins Hendrikkade in Amsterdam,"€2,250 per month",65 m²,214 m³,Apartment,1744,3,2,1,1,nan,Not present,Furnished
For rent: Apartment Damplein in Middelburg,"€1,100 per month",85 m²,nan,Apartment,1906,2,1,1,1,nan,Not present,Furnished
For rent: Apartment Heulstraat 23 in Den Haag,"€4,000 per month",195 m²,796 m³,Apartment,1750,7,5,2,3,Present,Present,Furnished
For rent: Apartment Geldropseweg in Eindhoven,€675 per month,29 m²,82 m³,Apartment,2017,1,nan,1,1,nan,Not present,Upholstered
For rent: Apartment Schalkwijkerstraat in Haarlem,"€1,750 per month",95 m²,257 m³,Apartment,1906-1930,5,3,1,2,Not present,"Present (11 m², located on the east)",nan
For rent: Apartment Schalkwijkstraat in Utrecht,"€1,895 per month",87 m²,180 m³,Apartment,1956,4,3,2,2,Not present,nan,Upholstered
For rent: Apartment Nachtegaalstraat in Utrecht,"€1,395 per month",65 m²,180 m³,Apartment,Before 1906,2,1,1,1,Not present,nan,Upholstered
For rent: House Binnenweg 12 1 in Ouderkerk aan de Amstel,"€10,000 per month",520 m²,2.080 m³,House,1928,6,4,3,3,Not present,Present (465 m²),Furnished
For rent: Apartment Hippolytusbuurt 43 E in Delft,"€1,050 per month",50 m²,160 m³,Apartment,2012,2,1,nan,2,Not present,Not present,Upholstered
For rent: Apartment Verspronckweg in Haarlem,"€1,625 per month",68 m²,250 m³,Apartment,1922,2,1,1,1,Not present,Not present,nan
For rent: Apartment Verspronckweg in Haarlem,"€1,475 per month",94 m²,300 m³,Apartment,1922,2,1,1,1,Not present,Not present,nan
For rent: Apartment Putstraat 22 in Sittard,€530 per month,28 m²,82 m³,Apartment,2019,2,nan,nan,1,Not present,Not present,Upholstered
For rent: Apartment Kapelweg in Maastricht,"€1,295 per month",95 m²,nan,Apartment,nan,2,1,1,nan,Present,Not present,Upholstered
For rent: Apartment Albert Cuypstraat 31 1 in Amsterdam,"€1,950 per month",50 m²,153 m³,Apartment,1890,2,1,1,1,Present,Not present,Upholstered or furnished
For rent: House Gein-Zuid 12 in Abcoude,"€3,000 per month",190 m²,nan,House,nan,4,3,1,nan,Not present,Present,Upholstered
For rent: Studio Herbenusstraat in Maastricht,€918 per month,35 m²,nan,Studio,nan,1,nan,1,nan,Not present,Present,Upholstered
For rent: Apartment Hoogbeeltplein in Maastricht,"€1,095 per month",80 m²,nan,Apartment,nan,2,1,1,nan,Present,Not present,Furnished
For rent: Apartment Heerderweg in Maastricht,"€1,550 per month",68 m²,nan,Apartment,nan,2,1,1,nan,Not present,Not present,Furnished
For rent: Apartment Kempkensweg 4 H in Heerlen,€638 per month,80 m²,nan,Apartment,1987,3,2,1,nan,Present,Not present,Shell
For rent: Apartment Goudsesingel in Rotterdam,"€1,475 per month",71 m²,nan,Apartment,nan,3,2,1,nan,Present,Not present,Furnished
For rent: Apartment Feijenoordkade in Rotterdam,"€2,100 per month",140 m²,nan,Apartment,nan,4,3,1,nan,Not present,Present,Upholstered
For rent: Apartment Parkstraat in Velp,"€1,455 per month",91 m²,175 m³,Apartment,2008,3,2,1,1,Present,Not present,nan
For rent: Apartment Parkstraat in Velp,"€1,305 per month",82 m²,224 m³,Apartment,2008,3,2,1,1,Present,Not present,nan
For rent: House van Lennepstraat in Son en Breugel,"€1,850 per month",164 m²,nan,House,1962,4,3,1,nan,nan,nan,Furnished
For rent: Apartment Harmenjansweg in Haarlem,"€1,950 per month",95 m²,nan,Apartment,nan,2,1,1,nan,Present,Not present,Upholstered
For rent: Apartment Parnassusweg in Amsterdam,"€2,650 per month",100 m²,nan,Apartment,nan,4,3,1,nan,Not present,Present,Upholstered
For rent: Apartment Willem van Boelrestraat in Rotterdam,"€1,350 per month",85 m²,nan,Apartment,nan,4,3,1,nan,Present,Not present,Upholstered
For rent: Apartment Statensingel in Rotterdam,"€2,300 per month",129 m²,nan,Apartment,1933,5,4,nan,nan,Present,Not present,Upholstered
For rent: Apartment J.H. van den Broekstraat 23 in Rotterdam,"€1,900 per month",115 m²,395 m³,Apartment,2000,5,4,1,2,Present,nan,Upholstered
For rent: Apartment Johan David Zocherstraat in Voorburg,"€1,900 per month",105 m²,294 m³,Apartment,2005,4,3,1,1,Present,nan,Upholstered
For rent: House Peppengouw 100 in Almere,"€1,750 per month",93 m²,nan,House,1980,5,3,1,nan,Not present,Present (located on the north),nan
For rent: House Ruimtevaartbaan in IJsselstein,"€1,475 per month",125 m²,nan,House,nan,4,3,1,3,nan,Present,Furnished
For rent: Apartment Ir J.P. van Muijlwijkstraat 68 C in Arnhem,"€1,066 per month",74 m²,nan,Apartment,nan,2,1,1,nan,Present,Not present,Shell
For rent: House Nieuwe Blekerstraat in Groningen,"€1,195 per month",67 m²,nan,House,nan,3,2,1,nan,nan,Present (12 m²),Upholstered
For rent: Apartment Meander in Amstelveen,"€2,700 per month",107 m²,355 m³,Apartment,1960,4,3,2,1,nan,Not present,Furnished
For rent: House Landsteinerstraat 62 in Geleen,"€1,050 per month",90 m²,nan,House,nan,5,4,1,nan,Present,Present,Upholstered
For rent: Apartment Torendijk in Kortgene,€785 per month,60 m²,nan,Apartment,nan,2,1,1,nan,Not present,Not present,Upholstered
For rent: Apartment Zacharias Jansenstraat in Den Haag,€647 per month,30 m²,78 m³,Apartment,1924,2,1,1,1,Not present,Not present,Upholstered
For rent: Apartment Zacharias Jansenstraat in Den Haag,€647 per month,33 m²,95 m³,Apartment,1924,2,2,1,1,Present,Not present,Upholstered
For rent: Apartment Zwolsestraat in Den Haag,"€1,650 per month",103 m²,310 m³,Apartment,1993,3,2,1,1,nan,Not present,Upholstered
For rent: House Sterrebosstraat 12 in Groningen,"€1,400 per month",140 m²,nan,House,nan,2,1,1,nan,Not present,Present (located on the east),Upholstered or furnished
For rent: Apartment Iepenweg in Amsterdam,"€1,425 per month",40 m²,nan,Apartment,1983,2,1,1,1,Present,Not present,Furnished
For rent: Room Paardestraat in Sittard,€395 per month,13 m²,nan,Room,nan,1,nan,nan,nan,nan,nan,Upholstered
For rent: House Molenbelt 54 in Deventer,"€1,125 per month",85 m²,nan,House,nan,4,3,1,nan,Not present,Present (20 m²),Shell
For rent: Apartment Wilhelminastraat in Breda,€975 per month,40 m²,nan,Apartment,nan,1,1,nan,nan,nan,Present,Upholstered
For rent: Apartment Albert Cuypstraat 31 1 in Amsterdam,"€1,950 per month",50 m²,153 m³,Apartment,1890,2,1,1,1,Present,Not present,Upholstered or furnished
For rent: House Winkeldijk 19 AR88 in Vinkeveen,"€1,300 per month",70 m²,nan,House,nan,3,2,1,nan,Not present,Present,Furnished
For rent: House Kruidhof 34 in Noordwijk,"€1,750 per month",135 m²,513 m³,House,1961,4,3,1,2,Not present,"Present (32 m², located on the west)",Furnished
For rent: Apartment Corellistraat 3 3 in Amsterdam,"€6,000 per month",181 m²,641 m³,Apartment,1930,7,5,2,3,Present,Not present,Upholstered
For rent: Apartment Lindenhoevestraat in Amsterdam,"€2,750 per month",121 m²,314 m³,Apartment,2018,4,3,1,1,Present,Present (18 m²),Furnished
For rent: Apartment Waalstraat in Enschede,€850 per month,75 m²,nan,Apartment,1964,4,3,1,nan,Present,nan,Shell
For rent: Apartment Parkstraat in Velp,"€1,305 per month",82 m²,150 m³,Apartment,2008,3,2,1,1,Present,Not present,nan
For rent: Apartment Stevensbloem 91 in Leiden,"€1,295 per month",79 m²,187 m³,Apartment,1986,3,2,1,1,Present,nan,Upholstered
For rent: House De Witte Raaflaan in Noordwijk,"€1,385 per month",98 m²,nan,House,nan,4,3,1,nan,nan,Present (300 m²),Furnished
For rent: Apartment Prins Hendrikstraat in Den Haag,"€1,330 per month",65 m²,180 m³,Apartment,1906,2,1,nan,1,nan,Not present,Upholstered
For rent: House Mondriaanstraat in Groningen,"€1,495 per month",88 m²,nan,House,nan,3,2,1,2,Present,Not present,Furnished
For rent: Apartment Burgemeester De Monchyplein in Den Haag,"€3,750 per month",179 m²,430 m³,Apartment,1996,6,3,nan,2,Present,Present,Upholstered
For rent: Apartment Rustenburgerstraat 133 III in Amsterdam,"€1,850 per month",46 m²,125 m³,Apartment,1909,3,2,1,1,Present,nan,Upholstered
For rent: Apartment Anjerhof in Aalsmeer,"€1,475 per month",58 m²,181 m³,Apartment,1987,3,2,1,1,Present,nan,Furnished
For rent: Apartment Gildepad in Haaren,"€2,000 per month",150 m²,nan,Apartment,nan,4,3,1,nan,Present,Not present,Furnished
For rent: Apartment Prinsengracht in Amsterdam,"€2,500 per month",72 m²,nan,Apartment,nan,2,1,1,nan,Not present,Not present,Furnished
For rent: House Grevingaheerd in Groningen,€850 per month,81 m²,nan,House,1981,3,2,1,nan,nan,nan,Furnished
For rent: House Adrianastraat 58 in Katwijk,"€1,750 per month",98 m²,260 m³,House,1928,5,4,1,2,Not present,Present (located on the south-east),Furnished
For rent: Room Mandjesstraat in Zwolle,€700 per month,62 m²,nan,Room,nan,3,nan,nan,nan,nan,nan,Shell
For rent: Apartment Groeninxstraat in Rotterdam,"€1,195 per month",66 m²,250 m³,Apartment,1933,3,2,1,1,Not present,Present,Upholstered
For rent: Room Korenstraat in Apeldoorn,€445 per month,18 m²,nan,Room,nan,1,nan,nan,nan,nan,nan,Upholstered
For rent: Apartment Rubensstraat 20 C in Rotterdam,"€1,600 per month",70 m²,200 m³,Apartment,1957,3,2,1,1,Present,Not present,Furnished
For rent: Apartment Espoortstraat in Enschede,"€1,025 per month",75 m²,nan,Apartment,1958,4,3,1,nan,Present,nan,Upholstered
For rent: Apartment Juliana van Stolbergstraat 7 E in Noord-Scharwoude,"€1,250 per month",69 m²,166 m³,Apartment,2014,3,2,1,1,Not present,"Present (30 m², located on the west)",Upholstered
For rent: Apartment Bordeslaan in Den Bosch,"€1,470 per month",110 m²,330 m³,Apartment,2005,3,2,1,1,nan,Present,Furnished
For rent: Apartment Frans van Mierisstraat 69 II in Amsterdam,"€4,850 per month",187 m²,615 m³,Apartment,1901,5,4,2,3,Present,nan,Upholstered
For rent: Apartment Rubensstraat in Ede,€731 per month,40 m²,nan,Apartment,nan,2,1,nan,nan,Not present,Not present,Shell
For rent: Apartment Rijksstraatweg in Haarlem,"€1,400 per month",79 m²,180 m³,Apartment,2013,2,1,1,1,Not present,nan,nan
For rent: Apartment Spuistraat in Amsterdam,"€1,675 per month",65 m²,169 m³,Apartment,Before 1906,2,1,1,1,Not present,Not present,Furnished
For rent: Apartment Melodiestraat in Den Haag,"€1,450 per month",83 m²,225 m³,Apartment,1925,3,2,nan,1,nan,Not present,Upholstered
For rent: Apartment Wilhelminaplein in Eindhoven,"€1,650 per month",65 m²,95 m³,Apartment,1928,3,2,1,1,nan,Not present,Furnished
For rent: Apartment Herengracht 579 1 in Amsterdam,"€5,400 per month",127 m²,440 m³,Apartment,1750,3,2,2,1,Not present,Present (96 m²),Furnished
For rent: House Dokter Bärstraat in Roermond,"€1,850 per month",116 m²,320 m³,House,2018,4,2,1,2,nan,Present (125 m²),Furnished
For rent: Apartment Straatweg in Rotterdam,"€1,595 per month",70 m²,150 m³,Apartment,1914,2,1,nan,1,nan,Not present,Furnished
For rent: Apartment Binnensingel in Vlaardingen,"€1,395 per month",134 m²,368 m³,Apartment,1913,4,3,nan,1,Present,nan,Upholstered
For rent: Room Jan Wapstraat 23 B room 1 in Den Haag,€725 per month,15 m²,nan,Room,nan,1,nan,nan,nan,nan,nan,Furnished
For rent: Apartment Parkstraat in Velp,"€1,430 per month",90 m²,224 m³,Apartment,2008,3,2,1,1,Present,Not present,nan
For rent: House Geuzenweg in Hilversum,"€1,425 per month",86 m²,215 m³,House,1905,3,2,1,2,nan,Present,Furnished
For rent: Apartment Waalstraat 185 in Enschede,€925 per month,71 m²,nan,Apartment,1964,4,3,1,nan,Present,Not present,Shell
For rent: Apartment Mgr. Aengenentlaan in Warmond,"€1,318 per month",89 m²,nan,Apartment,nan,2,1,1,nan,Not present,nan,Upholstered
For rent: Apartment Vlierstraat 68 in Venray,€960 per month,109 m²,nan,Apartment,nan,3,2,1,nan,Present,Not present,Shell
For rent: Apartment Hoofdweg in Midwolda,"€1,150 per month",70 m²,nan,Apartment,nan,2,1,1,nan,nan,Present (30 m²),Furnished
For rent: Apartment Wilhelminasingel in Maastricht,"€1,355 per month",41 m²,nan,Apartment,nan,2,1,1,1,nan,Not present,Furnished
For rent: Apartment Beijerlandsestraat 23 B in Rotterdam,"€1,250 per month",104 m²,nan,Apartment,nan,4,3,1,nan,Not present,Not present,Upholstered
For rent: Apartment Laan van Roos en Doorn in Den Haag,"€1,595 per month",98 m²,275 m³,Apartment,2000,3,2,nan,1,Not present,nan,Furnished
For rent: House Gilzeweg in Bavel,"€1,995 per month",180 m²,nan,House,nan,8,6,1,3,nan,Present,Upholstered
For rent: Apartment Hambeek 78 in Roermond,€866 per month,75 m²,205 m³,Apartment,1956,3,2,1,1,Present,Not present,Upholstered
For rent: House Boskleane in Bakkeveen,"€1,350 per month",140 m²,nan,House,1997,6,5,2,nan,Present,Present (400 m²),Furnished
For rent: Apartment Akerkstraat 31 in Groningen,€950 per month,50 m²,nan,Apartment,1901,2,1,1,nan,nan,nan,nan
For rent: Apartment Mary van der Sluisstraat 510 in Amsterdam,"€2,300 per month",83 m²,262 m³,Apartment,2017,3,2,1,1,Present,Not present,Furnished
For rent: Apartment Herenweg in De Bilt,"€1,500 per month",85 m²,187 m³,Apartment,1920,3,2,1,1,Present,Not present,Upholstered
For rent: Apartment Roerstraat in Den Haag,"€1,200 per month",71 m²,nan,Apartment,nan,2,1,1,nan,nan,nan,Upholstered
For rent: Apartment Koninginneweg 143 bov in Amsterdam,"€3,650 per month",138 m²,395 m³,Apartment,1905,5,4,2,3,Present,nan,Furnished
For rent: Apartment Ben van Meerendonkstraat in Amsterdam,"€4,950 per month",240 m²,801 m³,Apartment,2010,5,3,2,1,Not present,nan,Furnished
For rent: Apartment Willebrordusstraat 124 B in Rotterdam,"€1,275 per month",52 m²,170 m³,Apartment,1909,2,1,1,1,Not present,nan,Upholstered
For rent: Room Oude Rijn 27 K4 in Leiden,€741 per month,21 m²,nan,Room,nan,1,nan,nan,nan,nan,nan,Upholstered
For rent: Apartment Keesomstraat in Zandvoort,"€1,450 per month",86 m²,235 m³,Apartment,1971,3,2,1,1,Present,Not present,nan
For rent: House Meerkade 1 in Muiderberg,"€3,750 per month",180 m²,360 m³,House,2015,4,3,1,2,nan,Present,Furnished
For rent: Apartment Frederik Hendrikstraat 21 BS in Utrecht,"€2,500 per month",115 m²,nan,Apartment,nan,3,2,1,nan,Present,Not present,Furnished
For rent: House St Trudostraat in Eindhoven,"€2,250 per month",157 m²,nan,House,nan,4,3,2,nan,Not present,Present (58 m²),Upholstered or furnished
For rent: Apartment Prometheusstraat in Rotterdam,"€2,100 per month",104 m²,270 m³,Apartment,1999,3,2,nan,1,nan,Present (20 m²),Furnished
For rent: House Miquelstraat in Den Haag,"€1,125 per month",51 m²,nan,House,1931,3,2,1,nan,Not present,Present,nan
